{
  "channels": [
    {
      "capacity_msat": 2000000000000,
      "capital_cost_msat": 400000,
      "channel_id": "123x456x0",
      "confidence_micro": 850000,
      "exit_revenue_msat": 2000000,
      "exit_volume_msat": 900000000000,
      "forward_count": 142,
      "lifecycle": "PRODUCTIVE",
      "local_msat": 1200000000000,
      "net_value_msat": 2300000,
      "peer_id": "02aaaaaaaaaaaaaaaaaaaaaaaaaaaaaaaaaaaaaaaaaaaaaaaaaaaaaaaaaaaaaaaa",
      "protections": [
        {
          "expires_at": 1755000000,
          "owner": "lnplus",
          "reason": "lnplus_contract"
        }
      ],
      "rebalance_cost_msat": 800000,
      "receivable_msat": 780000000000,
      "remote_msat": 800000000000,
      "role": "ROUTER",
      "sourced_forward_count": 96,
      "sourced_value_msat": 1500000,
      "sourced_volume_msat": 700000000000,
      "spendable_msat": 1180000000000
    }
  ],
  "evidence_window_seconds": 2592000,
  "node": {
    "daily_budget": {
      "cap_msat": 10000000000,
      "reserved_msat": 2000000000,
      "spent_msat": 1000000000
    },
    "external_obligations": [],
    "onchain_confirmed_msat": 100000000000,
    "pending_operations": [],
    "receivable_objective_msat": 400000000000,
    "reserved_msat": 5000000000,
    "total_local_msat": 500000000000,
    "total_remote_msat": 300000000000
  },
  "observed_at": 1752300000,
  "schema_name": "economic_snapshot",
  "schema_version": 0,
  "snapshot_id": "cycle-000001"
}
